,title,link,room_size,price
0,"Studentenzimmer (10,12 m2) 3er WG-Laim ab 01.01.2019",https://www.wg-gesucht.de/wg-zimmer-in-Muenchen-Laim.3787089.html,10.0,420.0
1,Two rooms available - Möbliertes Zimmer in einer 3er WG am Goethe Institut,https://www.wg-gesucht.de/wg-zimmer-in-Muenchen-Neuhausen-Nymphenburg.4171665.html,11.0,600.0
2,Zimmer mit Himmelbett für 1 Monat zu vermieten*,https://www.wg-gesucht.de/wg-zimmer-in-Muenchen-Sendling.6927752.html,19.0,650.0
3,Möbliertes Zimmer an weibliche Wiesnbedienung,https://www.wg-gesucht.de/wg-zimmer-in-Muenchen-Lerchenau.6923957.html,11.0,310.0
4,УЮТНАЯ КОМНАТА В ЧАСТНОМ ДОМЕ В МЮНХЕНЕ,https://www.wg-gesucht.de/wg-zimmer-in-Muenchen-Ramersdorf.6782075.html,9.0,450.0
5,Sonniges Zimmer in München-Planegg,https://www.wg-gesucht.de/wg-zimmer-in-Muenchen-Planegg.6843287.html,12.0,250.0
6,Furnished room with balcony in a 3 Girls flatshare at Goethe Institut,https://www.wg-gesucht.de/wg-zimmer-in-Muenchen-Neuhausen-Nymphenburg.4785694.html,10.0,550.0
7,Neue Hauptmieterin gesucht - 30m² (2 Zimmer) in netter 4er WG - gute Lage,https://www.wg-gesucht.de/wg-zimmer-in-Muenchen-Schwabing-Nord.4358815.html,30.0,620.0
8,"Zwei teilmöblierte Zimmer für Berufstätige, auch ein Paar in der Maxvorstadt ab 1. Oktober zu vermieten",https://www.wg-gesucht.de/wg-zimmer-in-Muenchen-Maxvorstadt.6927720.html,20.0,600.0
9,Ruhiges Altbauzimmer Im Zentrum,https://www.wg-gesucht.de/wg-zimmer-in-Muenchen-Ludwigsvorstadt-Isarvorstadt.3578386.html,17.0,560.0
10,ab 1.Oktober für 5 Monate ruhiges schönes Zimmer Nähe Sendlinger Tor,https://www.wg-gesucht.de/wg-zimmer-in-Muenchen-Ludwigsvorstadt-Isarvorstadt.6636401.html,17.0,560.0
11,"Helles, ruhiges, voll möbliertes Zimmer in zentraler Lage mit vielen Freizeitangeboten und Einkaufsmöglichkeiten ab dem 01.11.18 sucht netten, bevorzugt männlichen und BERUFSTÄTIGEN Mitbewohner",https://www.wg-gesucht.de/wg-zimmer-in-Muenchen-Trudering.6908983.html,17.0,2.0
12,"3 möblierte Zimmer (ca. 13 qm) tw. mit Balkon, renoviert, ab sofort in zentraler Lage (Berg-am-Laim) zu vermieten, kostenfrei Internet/Sat-TV & Gartenmitbenutzung",https://www.wg-gesucht.de/wg-zimmer-in-Muenchen-Berg-am-Laim.6597045.html,13.0,570.0
13,Schönes grosses helles Zimmer /   30 qm  /   Metro  U2  Schwabing-Nord,https://www.wg-gesucht.de/wg-zimmer-in-Muenchen-Schwabing-Nord---naehe-BMW-Innovation-Centre-FIZ.470230.html,30.0,480.0
14,"Zimmer in schöner 2er-WG in Pasing direkt an der FH! 3-Zi.-Whg. in saniertem Altbau mit Dielenböden, Holzofen, Ost-Balkon usw.",https://www.wg-gesucht.de/wg-zimmer-in-Muenchen-Pasing-Obermenzing.6417458.html,18.0,670.0
15,15 qm Zimmer in Top-Lage am Kurfürstenplatz ab 1.12. zu vermieten,https://www.wg-gesucht.de/wg-zimmer-in-Muenchen-Schwabing-West.6903094.html,15.0,700.0
16,"Schönes, helles 19qm Zimmer mit Ausblick in gemischter 3er WG",https://www.wg-gesucht.de/wg-zimmer-in-Muenchen-Sendling.6805994.html,19.0,520.0
17,01.Jan. 2019 Super schönes Zimmer zentral Schwabing,https://www.wg-gesucht.de/wg-zimmer-in-Muenchen-Schwabing-West.6927636.html,12.0,650.0
18,"Tolle Lage in Schwabing, München gemeinsam erleben!",https://www.wg-gesucht.de/wg-zimmer-in-Muenchen-Schwabing-Freimann.5058099.html,12.0,200.0
19,Möbliertes Zimmer in Dreifamilienhaus,https://www.wg-gesucht.de/wg-zimmer-in-Muenchen-Feldmoching.6602782.html,16.0,550.0
20,Möbiliertes WG-Zimmer an der Donnersbergerbrücke für drei Wochen,https://www.wg-gesucht.de/wg-zimmer-in-Muenchen-Neuhausen-Nymphenburg.6891417.html,18.0,600.0
21,Möbliertes Zimmer / furnished room for shorttime / monthly  rent,https://www.wg-gesucht.de/wg-zimmer-in-Muenchen-Bogenhausen.4635567.html,25.0,849.0
22,"Schönes, ruhiges möbliertes Zimmer / fully furnishe room",https://www.wg-gesucht.de/wg-zimmer-in-Muenchen-Bogenhausen.6308628.html,22.0,849.0
23,Möbliertes Zimmer / fully furnished room,https://www.wg-gesucht.de/wg-zimmer-in-Muenchen-Bogenhausen.6170152.html,22.0,848.0
24,Möbliertes Zimmer/ furnished room available,https://www.wg-gesucht.de/wg-zimmer-in-Muenchen-Bogenhausen.6509938.html,20.0,849.0
25,"Sehr schönes, helles und ruhiges Zimmer, 16m²",https://www.wg-gesucht.de/wg-zimmer-in-Muenchen-Sendling.6119606.html,16.0,390.0
26,top WG zimmer zu vermieten Nähe München,https://www.wg-gesucht.de/wg-zimmer-in-Muenchen-top-WG-zimmer.4061496.html,15.0,450.0
27,schönes helles großes WG-Zimmer in einer 3-Zimmer-Wohnung relativ zentral!,https://www.wg-gesucht.de/wg-zimmer-in-Muenchen-Neuhausen-Nymphenburg.6913290.html,20.0,600.0
28,"Grosszügiges Zimmer in 3 zimmerwonung, zentral gelegen, sehr gepflegt und ruhig",https://www.wg-gesucht.de/wg-zimmer-in-Muenchen-Haidhausen.6927634.html,20.0,900.0
29,19 qm Zimmer zur Untermiete in Schwabing-West vom 14.10.18-10.11.18,https://www.wg-gesucht.de/wg-zimmer-in-Muenchen-Schwabing-West.6924749.html,19.0,540.0
30,"do READ the text carefully, thank you *** for a minimum of 2, a maximum 5 nights * NO long term, sorry * near bonner platz",https://www.wg-gesucht.de/wg-zimmer-in-Muenchen-Schwabing-West.6914767.html,15.0,33.0
31,"Sunny, south-facing room with great view",https://www.wg-gesucht.de/wg-zimmer-in-Muenchen-Moosach.4880504.html,12.0,720.0
32,Luxuriöse WG mit Dachterasse an der Prater Insel,https://www.wg-gesucht.de/wg-zimmer-in-Muenchen-Altstadt-Lehel.6927587.html,20.0,1200.0
33,10qm Zimmer in 4er WG wird frei :),https://www.wg-gesucht.de/wg-zimmer-in-Muenchen-Hadern.6926958.html,10.0,550.0
34,"Wg Zimmer in Pasing,gute Lage!",https://www.wg-gesucht.de/wg-zimmer-in-Muenchen-Muenchen.6927599.html,16.0,550.0
35,Nette WG sucht nette Mitbewohnerin für Zimmer 19m² in Einfamilienhaus,https://www.wg-gesucht.de/wg-zimmer-in-Muenchen-Ramersdorf-Perlach.6222478.html,19.0,550.0
36,AB SOFORT FREI! Neue große & helle Penthouse WG mit 2 Balkonen und eigenem Schwimmbad / IMMEDIATELY AVAILABLE! New large & bright penthouse apartment with 2 balconies and private swimming pool,https://www.wg-gesucht.de/wg-zimmer-in-Muenchen-Perlach.6562629.html,20.0,750.0
37,[All Inklusiv] Zimmer frei in neues RMH nähe Moosach (near to MAN/MTU/BMW),https://www.wg-gesucht.de/wg-zimmer-in-Muenchen-Feldmoching-Hasenbergl.6903852.html,15.0,800.0
38,komplett möbliertes Zimmer in sehr großer Wohnung,https://www.wg-gesucht.de/wg-zimmer-in-Muenchen-Westpark.3227537.html,13.0,520.0
39,Möbliertes WG-Zimmer in geräumigen Haus mit großem Garten,https://www.wg-gesucht.de/wg-zimmer-in-Muenchen-Maxvorstadt.6894556.html,18.0,380.0
40,TOP 1 Zimmer zu vergeben in einem 2 Zimmer Wohnung an der Münchner Freiheit,https://www.wg-gesucht.de/wg-zimmer-in-Muenchen-Schwabing-West.6714216.html,18.0,430.0
41,WG Zimmer in Isar Nähe,https://www.wg-gesucht.de/wg-zimmer-in-Muenchen-Thalkirchen-Obersendling.6316363.html,20.0,770.0
42,Möbliertes Frauen WG Zimmer 13qm,https://www.wg-gesucht.de/wg-zimmer-in-Muenchen-Planegg.4517562.html,16.0,370.0
43,Big room in great apartment in Haidhausen (3 WG),https://www.wg-gesucht.de/wg-zimmer-in-Muenchen-Au-Haidhausen.6119215.html,16.0,890.0
44,"Möbiliertes. Zi in 1er/2er - WG,in ruhigem Haus, München-Berg am Laim, nahe /U2 und Tram 19, zu vermieten",https://www.wg-gesucht.de/wg-zimmer-in-Muenchen-Berg-am-Laim.5165742.html,12.0,469.0
45,Wunderschönes Zimmer an Wochenendheimfahrer,https://www.wg-gesucht.de/wg-zimmer-in-Muenchen-Au-Haidhausen.6885938.html,20.0,650.0
46,1 Zimmer 12 qm in unserer 80 qm Wohnung,https://www.wg-gesucht.de/wg-zimmer-in-Muenchen-Lerchenau.5870872.html,12.0,550.0
47,18 qm in 3er WG-Neugründung am Prinzregentenplatz,https://www.wg-gesucht.de/wg-zimmer-in-Muenchen-Bogenhausen.6927547.html,18.0,600.0
48,Mitbewohnerin gesucht in München Zentrum ab1 Oktober 2018,https://www.wg-gesucht.de/wg-zimmer-in-Muenchen-Obergiesing.6816697.html,10.0,600.0
49,BMW FIZ Nähe: vollmöbliertes WG Zimmer in 3er WG zur Zwischenmiete (01.10.18 - 31.12.19),https://www.wg-gesucht.de/wg-zimmer-in-Muenchen-Milbertshofen-Am-Hart.6515170.html,10.0,650.0
50,Comfortable room,https://www.wg-gesucht.de/wg-zimmer-in-Muenchen-Au-Haidhausen.6920410.html,20.0,840.0
51,"Mittendrin,z. Stadt 33Min.Hbf u. Bergen, See (5Min.), im schönsten Ort Bayern`s",https://www.wg-gesucht.de/wg-zimmer-in-Muenchen-Bernried.5365264.html,20.0,490.0
52,"Am Starnberger See ist eine 2er WG - Z. frei, 35qm in 110qm gr. Wohnung",https://www.wg-gesucht.de/wg-zimmer-in-Muenchen-Am-Starnberger-See.5406878.html,35.0,680.0
53,AB SOFORT 3 Wochen Möbliertes Altbau WG Zimmer zur Untermiete,https://www.wg-gesucht.de/wg-zimmer-in-Muenchen-Maxvorstadt.6915852.html,16.0,450.0
54,FURNISHED AlRB'NB ► #balcony #loftbed @baldeplatz @wittelsbacherbrücke @kolumbusplatz @fraunhoferstraße @flaucher @rosengarten,https://www.wg-gesucht.de/wg-zimmer-in-Muenchen-Au-Haidhausen.6902256.html,18.0,630.0
55,FURNISHED AlRB'NB ► #balcony #loftbed @baldeplatz @wittelsbacherbrücke @kolumbusplatz @fraunhoferstraße @flaucher @rosengarten,https://www.wg-gesucht.de/wg-zimmer-in-Muenchen-Au-Haidhausen.6902301.html,18.0,60.0
56,15 qm Zimmer in komplett renovierter Wohnung mit super Anbindung,https://www.wg-gesucht.de/wg-zimmer-in-Muenchen-Pasing-Obermenzing.6808979.html,15.0,690.0
57,14qm Zimmer in ruhiger schöner Wohnung - möbliert,https://www.wg-gesucht.de/wg-zimmer-in-Muenchen-Milbertshofen-noerdlich-Schwabing.6700188.html,14.0,785.0
58,WG-Zimmer sucht Mieter,https://www.wg-gesucht.de/wg-zimmer-in-Muenchen-Neuhausen-Nymphenburg.6927446.html,10.0,640.0
59,Schönes möbliertes helles 16 qm Zimmer zur Untermiete,https://www.wg-gesucht.de/wg-zimmer-in-Muenchen-Schwabing-West.6704283.html,16.0,900.0
60,"Möbliertes sonniges Zimmer in netter 9er WG, zentral",https://www.wg-gesucht.de/wg-zimmer-in-Muenchen-Sendling.6911727.html,8.0,450.0
61,Zimmer (evtl. möbliert - Zeitdauer offen),https://www.wg-gesucht.de/wg-zimmer-in-Muenchen-Pasing-Zentrum.6646878.html,11.0,745.0
62,Zimmer mit Zugang zur Dachterrasse in 150qm Wohnung,https://www.wg-gesucht.de/wg-zimmer-in-Muenchen-Pasing-Zentrum.5886916.html,16.0,855.0
63,"Schönes, helles Zimmer befristet abzugeben",https://www.wg-gesucht.de/wg-zimmer-in-Muenchen-Untergiesing-Harlaching.6562344.html,16.0,450.0
64,Möbiliertes 35 qm Zimmer mit eigenem Bad,https://www.wg-gesucht.de/wg-zimmer-in-Muenchen-Berg-am-Laim.3025134.html,35.0,580.0
65,WG-Zimmer am Odeonsplatz,https://www.wg-gesucht.de/wg-zimmer-in-Muenchen-Altstadt-Lehel.6926583.html,15.0,700.0
66,Junger Mann mit Behinderung sucht sozialen WG Mitbewohner - 2er WG Stiglmairplatz (80 qm) / Maxvorstadt,https://www.wg-gesucht.de/wg-zimmer-in-Muenchen-Maxvorstadt.6927359.html,14.0,650.0
67,15 qm Zimmer in 3er WG,https://www.wg-gesucht.de/wg-zimmer-in-Muenchen-Schwanthalerhoehe-Laim.6526283.html,15.0,345.0
68,ZImmer zur Zwischenmiete in Maxvorstadt,https://www.wg-gesucht.de/wg-zimmer-in-Muenchen-Maxvorstadt.6923885.html,10.0,400.0
69,Zentrale Lage: 15 qm Zimmer in Schwabing ab 15.10 zu vergeben :),https://www.wg-gesucht.de/wg-zimmer-in-Muenchen-Schwabing-Olympiapark.6927318.html,15.0,490.0
70,Traum-WG in Obergiesing,https://www.wg-gesucht.de/wg-zimmer-in-Muenchen-Obergiesing.5377474.html,11.0,600.0
71,"Gemütliches Zimmer in traumhafter, ruhiger Wohnung",https://www.wg-gesucht.de/wg-zimmer-in-Muenchen-Obergiesing.6644348.html,20.0,640.0
72,Großes Zimmer in renovierter Altbauwohnung direkt am Wiener Platz,https://www.wg-gesucht.de/wg-zimmer-in-Muenchen-Au-Haidhausen.6927260.html,20.0,915.0
73,Helles und ruhiges WG Zimmer in traumhafter Altbauwohnung,https://www.wg-gesucht.de/wg-zimmer-in-Muenchen-Bogenhausen.5333262.html,20.0,980.0
74,Schönes Zimmer in zweier WG Nähe Theresienwiese zu vermieten,https://www.wg-gesucht.de/wg-zimmer-in-Muenchen-Schwanthalerhoehe-Laim.6926779.html,21.0,950.0
75,2er Studenten-WG in direkter Uni-Lage,https://www.wg-gesucht.de/wg-zimmer-in-Muenchen-Maxvorstadt.4838698.html,22.0,280.0
76,2er Studenten-WG in direkter Uni-Lage,https://www.wg-gesucht.de/wg-zimmer-in-Muenchen-Maxvorstadt.5725676.html,22.0,280.0
77,"Ideal f.Praktikum b.BMW/MAN/MTU, möbliertes Zi.mit Miniküche+VDSL",https://www.wg-gesucht.de/wg-zimmer-in-Muenchen-Milbertshofen-Am-Hart.1834610.html,15.0,697.0
78,Charmantes Zimmer in liebenswerter WG sucht neuen Bewohner,https://www.wg-gesucht.de/wg-zimmer-in-Muenchen-Pasing-Obermenzing.6887430.html,16.0,350.0
79,WG Neugründung / 2 Mädels gesucht,https://www.wg-gesucht.de/wg-zimmer-in-Muenchen-Ludwigsvorstadt-Isarvorstadt.6719061.html,15.0,500.0
80,Schönes Zimmer im Glockenbachviertel zu vermieten,https://www.wg-gesucht.de/wg-zimmer-in-Muenchen-Ludwigsvorstadt-Isarvorstadt.6927027.html,16.0,707.0
81,3er Wg-Neugründung in saniertem Altbau beim Prinzregentenplatz,https://www.wg-gesucht.de/wg-zimmer-in-Muenchen-Bogenhausen.6878823.html,16.0,500.0
82,Schönster Balkon! Befristet möglich...,https://www.wg-gesucht.de/wg-zimmer-in-Muenchen-Trudering.6531749.html,15.0,650.0
83,"Zwischenmiete :  ruhiges, helles Zimmer in Obergiesing",https://www.wg-gesucht.de/wg-zimmer-in-Muenchen-Obergiesing.6927129.html,24.0,1090.0
84,"Helles, ruhiges Zimmer in Obergiesing",https://www.wg-gesucht.de/wg-zimmer-in-Muenchen-Obergiesing.6344095.html,20.0,990.0
85,Schönes möbliertes  Zimmer in München,https://www.wg-gesucht.de/wg-zimmer-in-Muenchen-Berg-am-Laim.4273523.html,10.0,350.0
86,Zimmer zur Untermiete in absoluter Bestelage neben TU,https://www.wg-gesucht.de/wg-zimmer-in-Muenchen-Maxvorstadt.5171391.html,13.0,400.0
87,Zimmer in frisch renovierter 3er WG,https://www.wg-gesucht.de/wg-zimmer-in-Muenchen-Fasangarten.6271430.html,9.0,440.0
88,Möbliertes Studentenzimmer,https://www.wg-gesucht.de/wg-zimmer-in-Muenchen-Schwabing-West.4676078.html,20.0,320.0
89,WG Zimmer mit sehr guter Anbindung und Lage,https://www.wg-gesucht.de/wg-zimmer-in-Muenchen-Thalkirchen-Obersendling.6191647.html,16.0,530.0
90,Möbliertes Zimmer direkt am Oktoberfest,https://www.wg-gesucht.de/wg-zimmer-in-Muenchen-Schwanthalerhoehe-Laim.6884080.html,18.0,500.0
91,WG Zimmer in München Moosach! Erstbezug! Wohnung frisch renoviert!,https://www.wg-gesucht.de/wg-zimmer-in-Muenchen-Moosach.6926968.html,24.0,670.0
92,15qm - möbliert - Dachterasse - 04.11.18 - 22.11.18,https://www.wg-gesucht.de/wg-zimmer-in-Muenchen-Obergiesing.6468739.html,15.0,300.0
93,frei ab sofort: Erker-Zimmer in renovierter Altbau-Wohnung am schönsten Platz Haidhausens,https://www.wg-gesucht.de/wg-zimmer-in-Muenchen-Au-Haidhausen.6200195.html,22.0,800.0
94,Sehr schönes helles Zimmer  an Oktoberfestbedienung (weiblich)  günstig zu vermieten,https://www.wg-gesucht.de/wg-zimmer-in-Muenchen-Neuhausen-Nymphenburg.6926798.html,10.0,290.0
95,18 qm Zimmer in Milbertshofen Nähe Frankfurter Ring (U2),https://www.wg-gesucht.de/wg-zimmer-in-Muenchen-Milbertshofen-Am-Hart.5854579.html,18.0,640.0
96,"Schönes WG Zimmer in toller, großer Wohnung mit Balkon",https://www.wg-gesucht.de/wg-zimmer-in-Muenchen-Taufkirchen.5832259.html,13.0,455.0
97,"möbl. 9m2 Zimmer mit Balkon, TV, Dachterrasse mit Schwimmbad",https://www.wg-gesucht.de/wg-zimmer-in-Muenchen-Pasing-Obermenzing.6926920.html,9.0,600.0
98,Wg Zimmer ab November zu vermieten.,https://www.wg-gesucht.de/wg-zimmer-in-Muenchen-Sendling.6569053.html,24.0,650.0
99,Möbliertes kleines WG Zimmer ab sofort,https://www.wg-gesucht.de/wg-zimmer-in-Muenchen-Thalkirchen-Obersendling.6473939.html,12.0,550.0
100,Möbliertes 14 qm Zimmer,https://www.wg-gesucht.de/wg-zimmer-in-Muenchen-Glockenbachviertel.6926904.html,14.0,600.0
101,Möbliertes Zimmer in internationaler WG - Furnished Room in international shared flat,https://www.wg-gesucht.de/wg-zimmer-in-Muenchen-Berg-am-Laim.6910367.html,12.0,560.0
102,"Zimmer Frei , Zwischenmiete! only Girls !",https://www.wg-gesucht.de/wg-zimmer-in-Muenchen-Sendling.5637626.html,20.0,680.0
103,"möbliertes, Zimmer",https://www.wg-gesucht.de/wg-zimmer-in-Muenchen-Neuhausen-Nymphenburg.6711340.html,14.0,420.0
104,"WG-Zimmer in München-Allach (7min S-Bahn, 4min MAN)",https://www.wg-gesucht.de/wg-zimmer-in-Muenchen-Allach-Untermenzing.5828674.html,10.0,500.0
105,"möbl. 24m2 Zimmer mit Balkon, TV, Dachterrasse mit Schwimmbad",https://www.wg-gesucht.de/wg-zimmer-in-Muenchen-Pasing-Obermenzing.6926816.html,24.0,850.0
106,Fully furnished 19 Oct - 28 Oct,https://www.wg-gesucht.de/wg-zimmer-in-Muenchen-Laim.6186850.html,16.0,180.0
107,One room In Two Bedroom Flat With Large Common Area in Quiet Neighborhood near Nymphenburg Palace,https://www.wg-gesucht.de/wg-zimmer-in-Muenchen-Neuhausen-Nymphenburg.6195961.html,20.0,750.0
108,"Schönes, helles Zimmer in Großhadern (ONLY WOMAN, GERMAN)",https://www.wg-gesucht.de/wg-zimmer-in-Muenchen-Hadern.1483570.html,10.0,320.0
109,OKTOBERFEST!! Zimmer für 10 Tage zu vermieten,https://www.wg-gesucht.de/wg-zimmer-in-Muenchen-Hadern.6925432.html,10.0,200.0
110,MÖBLIERTES Dachgeschosszimmer mit eigenem Bad und perfekter Anbindung,https://www.wg-gesucht.de/wg-zimmer-in-Muenchen-Ramersdorf-Perlach.6091100.html,17.0,750.0
111,Möbliertes Studentenzimmer in Schwabing,https://www.wg-gesucht.de/wg-zimmer-in-Muenchen-Maxvorstadt.6032170.html,25.0,200.0
112,Möbliertes helles Studentenzimmer in Uninähe,https://www.wg-gesucht.de/wg-zimmer-in-Muenchen-Maxvorstadt.4898827.html,25.0,200.0
113,großes Zimmer in sehr Zentraler Lage,https://www.wg-gesucht.de/wg-zimmer-in-Muenchen-Ludwigsvorstadt-Isarvorstadt.6926729.html,20.0,700.0
114,Helles schönes möbliertes Zimmer in gepflegter 5er WG im Münchner Osten,https://www.wg-gesucht.de/wg-zimmer-in-Muenchen-Bogenhausen.2514775.html,14.0,530.0
115,Wohnen bei der Turnerschaft Cheruscia,https://www.wg-gesucht.de/wg-zimmer-in-Muenchen-Schwabing-Freimann.4976405.html,15.0,320.0
116,*September* Möbiliertes WG-Zimmer in Neuhausen,https://www.wg-gesucht.de/wg-zimmer-in-Muenchen-Neuhausen-Nymphenburg.6268108.html,18.0,22.0
117,Fully-Furnished room for two months,https://www.wg-gesucht.de/wg-zimmer-in-Muenchen-Bogenhausen.6920137.html,16.0,600.0
118,"Frei ab 01.10, möbliertes Zimmer nähe Prinzregentenplatz!",https://www.wg-gesucht.de/wg-zimmer-in-Muenchen-Au-Haidhausen.5595047.html,20.0,750.0
119,"Schönes, Helles WG-Zimmer in Schwabing-Freimann",https://www.wg-gesucht.de/wg-zimmer-in-Muenchen-Schwabing-Freimann.6916410.html,14.0,620.0
120,Studentin gesucht,https://www.wg-gesucht.de/wg-zimmer-in-Muenchen-Aubing-Lochhausen-Langwied.2956242.html,10.0,450.0
121,Schwabing SHARED ROOM for students,https://www.wg-gesucht.de/wg-zimmer-in-Muenchen-Schwabing-West.6306941.html,20.0,400.0
122,"Möbliertes 12qm Zimmer in ruhiger 2er WG, zentral",https://www.wg-gesucht.de/wg-zimmer-in-Muenchen-Bogenhausen.6110444.html,12.0,620.0
123,Zwischenmieter/in gesucht - Altbauwohnung in Schwabing,https://www.wg-gesucht.de/wg-zimmer-in-Muenchen-Schwabing-West.5631563.html,17.0,600.0
124,Zimmer in WG mit großer Dachterasse am Hirschgarten,https://www.wg-gesucht.de/wg-zimmer-in-Muenchen-Neuhausen-Nymphenburg.6225483.html,18.0,850.0
125,28qm Zimmer in 2er WG bei der Wiesn,https://www.wg-gesucht.de/wg-zimmer-in-Muenchen-Ludwigsvorstadt-Isarvorstadt.6880311.html,28.0,622.0
126,"Ismaning,   Zwei Schöne ruhige ,möblierte Zimmer in einem Haus mit garten ,",https://www.wg-gesucht.de/wg-zimmer-in-Muenchen-Ismaning.6012728.html,15.0,600.0
127,WG-Gründung Toplage mit Wohnzimmer und Balkon Zimmer 1,https://www.wg-gesucht.de/wg-zimmer-in-Muenchen-Maxvorstadt.6925411.html,16.0,750.0
128,7er WG /Wettersteinplatz München / teilmöbliert / gehoben,https://www.wg-gesucht.de/wg-zimmer-in-Muenchen-Giesing.6642293.html,16.0,700.0
129,WG-Gründung Toplage mit Wohnzimmer und Balkon Zimmer 2,https://www.wg-gesucht.de/wg-zimmer-in-Muenchen-Maxvorstadt.6925434.html,15.0,730.0
130,Wohnzimmer in eine WG Karl-Theodorstr,https://www.wg-gesucht.de/wg-zimmer-in-Muenchen-Schwabing-Nord.3031382.html,20.0,830.0
131,Schlafzimmer in eine WG Karl-Theodorstr,https://www.wg-gesucht.de/wg-zimmer-in-Muenchen-Schwabing-Nord.3031384.html,20.0,830.0
132,Helles freundliches Zimmer  ab November,https://www.wg-gesucht.de/wg-zimmer-in-Muenchen-Sendling.6919419.html,13.0,500.0
133,1 Zimmer in 3er WG; Leopoldstraße nahe Münchner Freiheit,https://www.wg-gesucht.de/wg-zimmer-in-Muenchen-Schwabing.6926462.html,11.0,550.0
134,Mitbewohner(-in) gesucht für Traumwohnung im Glockenbachviertel nähe Isar,https://www.wg-gesucht.de/wg-zimmer-in-Muenchen-Ludwigsvorstadt-Isarvorstadt.6926384.html,17.0,850.0
135,"Möbliertes WG-Zimmer, 20 qm in netter 3er WG",https://www.wg-gesucht.de/wg-zimmer-in-Muenchen-Pasing-Obermenzing.6926486.html,20.0,610.0
136,"Preiswertes, möbliertes Zimmer in Münchens bester Lage",https://www.wg-gesucht.de/wg-zimmer-in-Muenchen-Altstadt-Lehel.5199018.html,16.0,290.0
137,Möbliertes Zimmer von 17.09 bis 17.10.2018 zum Vermieten,https://www.wg-gesucht.de/wg-zimmer-in-Muenchen-Ludwigsvorstadt-Isarvorstadt.6919918.html,18.0,350.0
138,"ab 1.10.18- WG-Zimmer zur Zwischenmiete im Münchner Osten (Nähe Messe, Siemens, Atos, Wacker Chemie, Gernerali, Allianz, Bosch u.a.)",https://www.wg-gesucht.de/wg-zimmer-in-Muenchen-Trudering.3278644.html,23.0,610.0
139,17qm Zimmer in 3er WG zu vergeben (Lehel),https://www.wg-gesucht.de/wg-zimmer-in-Muenchen-Altstadt-Lehel.6690146.html,18.0,760.0
140,Möbliertes 15qm Zimmer in 3er WG,https://www.wg-gesucht.de/wg-zimmer-in-Muenchen-Schwanthalerhoehe-Laim.6608342.html,16.0,365.0
141,Zimmer mitten in der Stadt nähe HBF für 4 Monate (18.11.2018 - ca 28.02.2019),https://www.wg-gesucht.de/wg-zimmer-in-Muenchen-Ludwigsvorstadt-Isarvorstadt.6234224.html,19.0,700.0
142,**** Schön Wohnen in Bogenhausen - Cosimapark *****,https://www.wg-gesucht.de/wg-zimmer-in-Muenchen-Bogenhausen.6387616.html,12.0,390.0
143,"Möbliertes ca 20 qm großes, helles und schön eingerichtetes Zimmer in zentraler Lage nähe Ubahn Poccistr",https://www.wg-gesucht.de/wg-zimmer-in-Muenchen-Ludwigsvorstadt-Isarvorstadt.6699019.html,20.0,850.0
144,"***** 15qm Zimmer mit Blick ins Grüne in super 4er WG, direkt am Flaucher (Isar) *****",https://www.wg-gesucht.de/wg-zimmer-in-Muenchen-Untergiesing-Harlaching.6009827.html,15.0,496.0
145,Möbliertes Zimmer 11 qm,https://www.wg-gesucht.de/wg-zimmer-in-Muenchen-Lerchenau.6923934.html,11.0,510.0
146,"Gemütliches, kleines Zimmer in Schwabinger WG",https://www.wg-gesucht.de/wg-zimmer-in-Muenchen-Schwabing.6904943.html,10.0,480.0
147,(Teil)Möbliertes 14 m2 Zimmer in toller Gegend,https://www.wg-gesucht.de/wg-zimmer-in-Muenchen-Obergiesing.4871841.html,14.0,670.0
148,Zimmer frei in 4-er WG im Herzen von München,https://www.wg-gesucht.de/wg-zimmer-in-Muenchen-Maxvorstadt.6782251.html,28.0,950.0
149,"Schönes, möbliertes WG-Zimmer in Schwabing",https://www.wg-gesucht.de/wg-zimmer-in-Muenchen-Schwabing-West.4901051.html,13.0,680.0
150,"Neuhausen - helles, gemütliches Gästezimmer auf Zeit",https://www.wg-gesucht.de/wg-zimmer-in-Muenchen-Neuhausen.6926140.html,14.0,600.0
151,Helles Zimmer in Top Altbau mit eigenem Bad - Glockenbachviertel,https://www.wg-gesucht.de/wg-zimmer-in-Muenchen-Gaertnerplatz-Glockenbach.1845912.html,25.0,900.0
152,Möbliertes Zimmer in schöner 5er WG,https://www.wg-gesucht.de/wg-zimmer-in-Muenchen-Sendling.6699870.html,10.0,475.0
153,200€ Belohnung für ein WG Zimmer,https://www.wg-gesucht.de/wg-zimmer-in-Muenchen-Muenchen.6926153.html,15.0,550.0
154,Voll möbliertes 19qm Zimmer + Loggia in einer 3er WG,https://www.wg-gesucht.de/wg-zimmer-in-Muenchen-Sendling.5760840.html,19.0,800.0
155,Schönes Zimmer in 4er WG im Gärtnerplatzviertel,https://www.wg-gesucht.de/wg-zimmer-in-Muenchen-Ludwigsvorstadt-Isarvorstadt.6926155.html,19.0,600.0
156,8m² girl's rooms - 1min. walk to S-Bahn - 18min. ride to Hbf,https://www.wg-gesucht.de/wg-zimmer-in-Muenchen-Allach-Untermenzing.2160804.html,8.0,300.0
157,Teilmöbliertes Zimmer mit BALKON in 3er WG,https://www.wg-gesucht.de/wg-zimmer-in-Muenchen-Ramersdorf-Perlach.5853175.html,15.0,660.0
158,Zimmer mit Gästebad zu vermieten,https://www.wg-gesucht.de/wg-zimmer-in-Muenchen-Thalkirchen-Obersendling.6926056.html,10.0,550.0
159,Möbliertes Zimmer in netter 2er-WG,https://www.wg-gesucht.de/wg-zimmer-in-Muenchen-Ludwigsvorstadt-Isarvorstadt.5095485.html,17.0,750.0
160,16 m² (+22m² gemeinsames Wohnzimmer) am Waldfriedhof,https://www.wg-gesucht.de/wg-zimmer-in-Muenchen-Sendling-Westpark.6604404.html,16.0,600.0
161,Schönes WG-Zimmer in gemütlichen Reihenhaus,https://www.wg-gesucht.de/wg-zimmer-in-Muenchen-Feldmoching-Hasenbergl.6922577.html,20.0,750.0
162,Gemütliches Zimmer in Haidhausen / Cosy Room in Haidhausen,https://www.wg-gesucht.de/wg-zimmer-in-Muenchen-Au-Haidhausen.4609715.html,10.0,500.0
163,helles Dachgeschoßzimmer in Neuried ca.25qm Wohnfläche mit Waschbecken und TV,https://www.wg-gesucht.de/wg-zimmer-in-Muenchen-Forstenried-Fuerstenried.6925245.html,25.0,590.0
164,Möbliertes WG-Zimmer in geräumigen Haus mit großem Garten,https://www.wg-gesucht.de/wg-zimmer-in-Muenchen-Unterhaching.6787124.html,14.0,700.0
165,WG-Haus in Grafing-Bahnhof bei München mit großem Garten,https://www.wg-gesucht.de/wg-zimmer-in-Muenchen-Grafing-bei-Muenchen.4093959.html,18.0,360.0
166,Komplett möbliertes Zimmer/ fully furnished 2er WG,https://www.wg-gesucht.de/wg-zimmer-in-Muenchen-Bogenhausen.5449967.html,22.0,848.0
167,Möbliertes Zimmer in einer Doppelhaushälfte,https://www.wg-gesucht.de/wg-zimmer-in-Muenchen-Aubing-Lochhausen-Langwied.6926024.html,10.0,600.0
168,2er WG Bonner Platz - 16m2 Zimmer,https://www.wg-gesucht.de/wg-zimmer-in-Muenchen-Schwabing-West.6842977.html,16.0,699.0
169,1 Zimmer  18QMmöblierte 3 Zimmer Wohnung,https://www.wg-gesucht.de/wg-zimmer-in-Muenchen-Ramersdorf-Perlach.3773820.html,15.0,475.0
170,Gemütl.Zimmer im Münchner Süden,https://www.wg-gesucht.de/wg-zimmer-in-Muenchen-Buchenhain-Baierbrunn.6926006.html,16.0,650.0
171,"9 m²  Zimmer, in 62m² Wohnung über Wiesn Zeit zu vermieten. Bei gesamten Aufenthalt gibt es einen Pauschalpreis.",https://www.wg-gesucht.de/wg-zimmer-in-Muenchen-Au-Haidhausen.6498612.html,9.0,35.0
